{
  "id": "formats/aiff/read/aifc_fl32_stereo",
  "title": "Read: AIFF-C fl32 stereo",
  "juce_tag": "9.0.4",
  "tolerance": "exact",
  "wp": "WP-2.1-17",
  "ledger_rows": ["juce_audio_formats/AiffAudioFormat"],
  "docs": [{"page": "AiffAudioFormat", "member": "createReaderFor", "says": "Makes a reader for a stream that holds audio in this format, or fails."}],
  "op": "read",
  "input_hex": "464f524d00000050414946434656455200000004a2805140434f4d4d000000180002000000020020400ebb80000000000000666c3332017853534e440000001800000000000000003f000000be8000003fc00000ba83126f",
  "record": ["opened", "sample_rate", "num_channels", "length_in_samples", "bits_per_sample", "uses_floating_point_data", "samples_f32", "metadata_values"],
  "notes": "Built by syrp-format-aiff tests/common/files.rs from the public AIFF 1.3 and AIFF-C layouts. Record whether a reader is created and, if so, everything it reports."
}
