{
  "id": "formats/aiff/read/aifc_sowt_stereo",
  "title": "Read: AIFF-C sowt (little-endian) 16-bit stereo",
  "juce_tag": "9.0.4",
  "tolerance": "exact",
  "wp": "WP-2.1-17",
  "ledger_rows": ["juce_audio_formats/AiffAudioFormat"],
  "docs": [{"page": "AiffAudioFormat", "member": "createReaderFor", "says": "Makes a reader for a stream that holds audio in this format, or fails."}],
  "op": "read",
  "input_hex": "464f524d00000048414946434656455200000004a2805140434f4d4d000000180002000000020010400ebb80000000000000736f7774017853534e44000000100000000000000000004000c0ff7f0080",
  "record": ["opened", "sample_rate", "num_channels", "length_in_samples", "bits_per_sample", "uses_floating_point_data", "samples_f32", "metadata_values"],
  "notes": "Built by syrp-format-aiff tests/common/files.rs from the public AIFF 1.3 and AIFF-C layouts. Record whether a reader is created and, if so, everything it reports."
}
