{
  "id": "formats/aiff/read/odd_and_unknown_chunks",
  "title": "Read: An odd-sized unknown chunk before COMM and an odd-sized SSND with its pad byte",
  "juce_tag": "9.0.4",
  "tolerance": "exact",
  "wp": "WP-2.1-17",
  "ledger_rows": ["juce_audio_formats/AiffAudioFormat"],
  "docs": [{"page": "AiffAudioFormat", "member": "createReaderFor", "says": "Makes a reader for a stream that holds audio in this format, or fails."}],
  "op": "read",
  "input_hex": "464f524d0000003e414946467a7a7a7a000000036f646400434f4d4d000000120001000000030008400dac4400000000000053534e440000000b000000000000000001020300",
  "record": ["opened", "sample_rate", "num_channels", "length_in_samples", "bits_per_sample", "uses_floating_point_data", "samples_f32", "metadata_values"],
  "notes": "Built by syrp-format-aiff tests/common/files.rs from the public AIFF 1.3 and AIFF-C layouts. Record whether a reader is created and, if so, everything it reports."
}
