{
  "id": "formats/aiff/read/metadata",
  "title": "Read: MARK, INST loops, NAME, AUTH, (c), two ANNO, COMT and APPL chunks",
  "juce_tag": "9.0.4",
  "tolerance": "exact",
  "wp": "WP-2.1-17",
  "ledger_rows": ["juce_audio_formats/AiffAudioFormat"],
  "docs": [{"page": "AiffAudioFormat", "member": "createReaderFor", "says": "Makes a reader for a stream that holds audio in this format, or fails."}],
  "op": "read",
  "input_hex": "464f524d000000e441494646434f4d4d000000120001000000040010400eac440000000000004d41524b000000260003000100000000057374617274000200000002086c6f6f7020656e64000003000000030000494e5354000000143c00007f017f00000001000100020002000200034e414d450000000654616b6520334155544800000007536f6d656f6e6500286329200000000c3230323620536f6d656f6e65414e4e4f00000005666972737400414e4e4f000000067365636f6e64434f4d540000000200004150504c000000047379727053534e440000001000000000000000004000c0007fff8000",
  "record": ["opened", "sample_rate", "num_channels", "length_in_samples", "bits_per_sample", "uses_floating_point_data", "samples_f32", "metadata_values"],
  "notes": "Built by syrp-format-aiff tests/common/files.rs from the public AIFF 1.3 and AIFF-C layouts. Record whether a reader is created and, if so, everything it reports."
}
